create table e
(
 eno number(2) primary key,
ename varchar2(15),
sal  number (5),
 comm  number(4),
 job  varchar2(10),
 dno  number(3)
);
insert into e values( 1,'pratz',50000,500,'Manager',10);
insert into e values( 2,'swarali',5007,700,'HR',20);
insert into e values( 3,'swapnali',6000,800,'Analyst',30);
insert into e values( 4,'sayali',40007,600,'engineer',10);

alter table e
add constraints e_dno_fk  foreign key (dno) 
references dept(dno);
*****************************
create table dept
(
dno number(2) primary key,
dept_name varchar2(15),
dlocid number(3)
);

 insert into dept values(10,'Science',101);
insert into dept values(20,'commerce',102);
insert into dept values(30,'Arts',103);

add constraint dept_dlocid_fk  foreign key (dlocid) 
references location(lid)
**********************************
create table location
(
lid number(3) primary key,
area varchar2(10),
state varchar2 (10),
cid number(3)
);
 insert into location values(101,'KN','MH',51);
insert into location values(102,'deccan','gujrat',105);
insert into  location values(103,'waraje','UP',107)

add constraint location_cid_fk  foreign key (cid) 
references country (cid)

**************************************
create table  country
(
cid number(3) primary key,
cname varchar2(10)
);
insert into country values(51,'India');
insert into country values(105,'India');
insert into country values(107,'UK');
*************************************************











SQL>  select * from e;

       ENO ENAME                  SAL       COMM JOB               DNO
---------- --------------- ---------- ---------- ---------- ----------
         1 pratz                50000        500 Manager            10
         2 swarali               5007        700 HR                 20
         3 swapnali              6000        800 Analyst            30
         4 sayali               40007        600 engineer           10

SQL> commit;

Commit complete.

SQL>  select * from  dept;

       DNO DEPT_NAME           DLOCID
---------- --------------- ----------
        10 Science                101
        20 commerce               102
        30 Arts                   103

SQL> commit;

Commit complete.

SQL> select * from location;

       LID AREA       STATE             CID
---------- ---------- ---------- ----------
       101 KN         MH                 51
       102 deccan     gujrat            105
       103 waraje     UP                107

SQL> commit;

Commit complete.

SQL> select * from country;

       CID CNAME
---------- ----------
        51 India
       105 India
       107 UK

SQL> commit;

Commit complete.
**********************************

SQL> select ename from  e, dept
  2  where e.dno = dept.dno
  3  and dept.dept_name ='Arts';

ENAME
---------------
swapnali

(********************************************

SQL> select dept_name from e,dept
  2  where e.dno = dept.dno
  3  and e.ename ='swarali';

DEPT_NAME
---------------
commerce

*******************************


SQL> select* from  e, dept, location
  2  where e.dno = dept.dno
  3  and dept.dlocid = location.lid and
  4  location.state ='MH';

       ENO ENAME                  SAL       COMM JOB               DNO
---------- --------------- ---------- ---------- ---------- ----------
       DNO DEPT_NAME           DLOCID        LID AREA       STATE
---------- --------------- ---------- ---------- ---------- ----------
       CID
----------
         1 pratz                50000        500 Manager            10
        10 Science                101        101 KN         MH
        51

         4 sayali               40007        600 engineer           10
        10 Science                101        101 KN         MH
        51

       ENO ENAME                  SAL       COMM JOB               DNO
---------- --------------- ---------- ---------- ---------- ----------
       DNO DEPT_NAME           DLOCID        LID AREA       STATE
---------- --------------- ---------- ---------- ---------- ----------
       CID
----------
****************************************


SQL> select ename from e ,dept
  2  where e.dno = dept.dno
  3  and dept.dept_name !='Arts'
  4  and sal between 5000 and 10000;

ENAME
---------------
swarali
*****************************************************



SQL> select* from e;

       ENO ENAME                  SAL       COMM JOB               DNO
---------- --------------- ---------- ---------- ---------- ----------
         1 pratz                50000        500 Manager            10
         2 swarali               5007        700 HR                 20
         3 swapnali              6000        800 Analyst            30
         4 sayali               40007        600 engineer           10

SQL> alter table e
  2  add hdate date;

Table altered.

SQL> update e
  2  set hdate = '17 dec 2013'
  3  where eno = 1;

1 row updated.


SQL> update e
  2  set hdate= '1 jan 2014'
  3  where ename = 'swarali';

1 row updated.

SQL> update e
  2  set hdate = '17 apr 2019'
  3  where ename = 'swapnali';

1 row updated.

SQL> update e
  2  set hdate= '25 jan 2016'
  3  where ename = 'sayali';

1 row updated.


SQL> select * from e;

       ENO ENAME                  SAL       COMM JOB               DNO HDATE
---------- --------------- ---------- ---------- ---------- ---------- ---------
         1 pratz                50000        500 Manager            10 17-DEC-13
         2 swarali               5007        700 HR                 20 01-JAN-14
         3 swapnali              6000        800 Analyst            30 17-APR-19
         4 sayali               40007        600 engineer           10 25-JAN-16


SQL> select ename,job,sal,hdate  from e,dept
  2  where e.dno = dept.dno
  3  and dept.dept_name in ('Arts','Science');

ENAME           JOB               SAL HDATE
--------------- ---------- ---------- ---------
pratz           Manager         50000 17-DEC-13
swapnali        Analyst          6000 17-APR-19
sayali          engineer        40007 25-JAN-16

SQL>*************************************************************

SQL> select dept_name from dept,location,country
  2  where dept.dlocid = location.lid
  3  and location.cid = country.cid
  4  and country.cname = 'India';

DEPT_NAME
---------------
Science
commerce

SQL> select * from country;

       CID CNAME
---------- ----------
        51 India
       105 India
       107 UK

SQL> select* from location;

       LID AREA       STATE             CID
---------- ---------- ---------- ----------
       101 KN         MH                 51
       102 deccan     gujrat            105
       103 waraje     UP                107

SQL> select* from dept;

       DNO DEPT_NAME           DLOCID
---------- --------------- ----------
        10 Science                101
        20 commerce               102
        30 Arts                   103
************************************************************************************


create table company
(
cid number(3), 
cname varchar2(15)
);

> alter table company
   add primary key(cid);

insert into company values(101,'LG');
insert into company values(102,'samsung');
insert into company values(103,' whirpool');
********************************



create table product
(
pid number(3) primary key,
pname varchar2(15),
price number(5),
cid number(3) 
);
insert into  product values(1,'fridge',50000,101);
insert into  product values(2,'mobile',20000,102);
insert into  product values(3,'ac',25500,103);
insert into  product values(4,'mixer',20000,null);
insert into  product values(5,'radio',1000,null);
insert into  product values(6,'FM',100,105);
insert into  product values(7,'Cdplayer',5000,106);
alter table product
add constraints prod_fk_cid foreign key (cid)
references company(cid);


*********************************************


L> select* from company;

     CID CNAME
-------- ---------------
     101 LG
     102 samsung
     103  whirpool
     104 Nokia
     107 airtel


SQL> select* from product;

       PID PNAME                PRICE        CID
---------- --------------- ---------- ----------
         1 fridge               50000        101
         2 mobile               20000        102
         3 ac                   25500        103
         4 mixer                20000
         5 radio                 1000


SQL> select * from company left join product
  2  on company.cid = product.cid
  3  ;

       CID CNAME                  PID PNAME                PRICE        CID
---------- --------------- ---------- --------------- ---------- ----------
       101 LG                       1 fridge               50000        101
       102 samsung                  2 mobile               20000        102
       103  whirpool                3 ac                   25500        103
       107 airtel
       104 Nokia

SQL> select * from company right join product
  2   on company.cid = product.cid;

       CID CNAME                  PID PNAME                PRICE        CID
---------- --------------- ---------- --------------- ---------- ----------
       101 LG                       1 fridge               50000        101
       102 samsung                  2 mobile               20000        102
       103  whirpool                3 ac                   25500        103
                                    4 mixer                20000
                                    5 radio                 1000

SQL> select * from company full join product
  2   on company.cid = product.cid;

       CID CNAME                  PID PNAME                PRICE        CID
---------- --------------- ---------- --------------- ---------- ----------
       101 LG                       1 fridge               50000        101
       102 samsung                  2 mobile               20000        102
       103  whirpool                3 ac                   25500        103
                                    4 mixer                20000
                                    5 radio                 1000
       107 airtel
       104 Nokia

7 rows selected.



*************************************************

 select * from company inner join product
  on company.cid = product.cid;

   CID CNAME                  PID PNAME                PRICE        CID
------ --------------- ---------- --------------- ---------- ----------
   101 LG                       1 fridge               50000        101
   102 samsung                  2 mobile               20000        102
   103  whirpool                3 ac                   25500        103




SQL>************************************************************

SQL> select * from company natural join product;

       CID CNAME                  PID PNAME                PRICE
---------- --------------- ---------- --------------- ----------
       101 LG                       1 fridge               50000
       102 samsung                  2 mobile               20000
       103  whirpool                3 ac                   25500


*************************************************************************



SQL> create table Employeenew
  2  ( ename varchar2(10),
  3  city varchar2(10)
  4  );

Table created.


SQL> insert into Employeenew values('a','pune');

1 row created.

SQL> insert into Employeenew values('b','patana');

1 row created.

SQL> insert into Employeenew values('c','mumbai');

1 row created.

SQL> insert into Employeenew values('d','nashik');

1 row created.

SQL> insert into Employeenew values('e','pune');

1 row created.


SQL> insert into Employeenew values('f','nahgar');

1 row created.

SQL> insert into Employeenew values('I','pune');

1 row created.

SQL> select * from Employeenew;

ENAME      CITY
---------- ----------
a          pune
b          patana
c          mumbai
d          nashik
e          pune
f          nahgar
I          pune

7 rows selected.


SQL> create table  empnew2 as select * from Employeenew;

Table created.

SQL> select empnew2.ename from  Employeenew, empnew2
  2  where Employeenew.ename = 'I'and Employeenew.city = empnew2.city;

ENAME
----------
a
e
I


SQL>

