
SQL> create table emp_c
  2  (
  3   eno number(4),
  4   ename varchar2(10),
  5   job varchar2( 10),
  6   manager number(3),
  7   dept_no number(3),
  8   hdate date,
  9   sal number(6),
 10   gender char(1),
 11   comm number(3)
 12   );

Table created.

****************************************************************

SQL> desc emp_c;
 Name                                      Null?    Type
 ----------------------------------------- -------- ----------------------------
 ENO                                                NUMBER(4)
 ENAME                                              VARCHAR2(10)
 JOB                                                VARCHAR2(10)
 MANAGER                                            NUMBER(3)
 DEPT_NO                                            NUMBER(3)
 HDATE                                              DATE
 SAL                                                NUMBER(6)
 GENDER                                             CHAR(1)
 COMM                                               NUMBER(3)

SQL> insert into emp_c values(101,'Sagar','cleark',112,10,'2 Aug 2016',10000,'M',200);

1 row created.

SQL> insert into emp_c values(102,'Sameer','cleark',112,10,'5 Aug 2017',11000,'M',250);

1 row created.

SQL> insert into emp_c values(105,'Priya','salesman',103,20,'3 May 2011',20000,'F',200);

1 row created.

SQL> insert into emp_c values(104,'Amol','manager',105,30,'1 June 2009',30000,'M',300);

1 row created.

SQL> insert into emp_c values(103,'Soham','analyst',104,50,'2 Dec 2007',40000,'M',200);

1 row created.

SQL> insert into emp_c values(107,'Samiksha','preci',null,90,'5 Feb 2005',55000,'F',400);

1 row created.

SQL> select * from emp_c;

       ENO ENAME      JOB           MANAGER    DEPT_NO HDATE            SAL G
---------- ---------- ---------- ---------- ---------- --------- ---------- -
      COMM
----------
       101 Sagar      cleark            112         10 02-AUG-16      10000 M
       200

       102 Sameer     cleark            112         10 05-AUG-17      11000 M
       250

       105 Priya      salesman          103         20 03-MAY-11      20000 F
       200


       ENO ENAME      JOB           MANAGER    DEPT_NO HDATE            SAL G
---------- ---------- ---------- ---------- ---------- --------- ---------- -
      COMM
----------
       104 Amol       manager           105         30 01-JUN-09      30000 M
       300

       103 Soham      analyst           104         50 02-DEC-07      40000 M
       200

       107 Samiksha   preci                         90 05-FEB-05      55000 F
       400


6 rows selected.

SQL> set pagesize 180;
SQL> set linesize 180;
SQL> select * from emp_c;

       ENO ENAME      JOB           MANAGER    DEPT_NO HDATE            SAL G       COMM
---------- ---------- ---------- ---------- ---------- --------- ---------- - ----------
       101 Sagar      cleark            112         10 02-AUG-16      10000 M        200
       102 Sameer     cleark            112         10 05-AUG-17      11000 M        250
       105 Priya      salesman          103         20 03-MAY-11      20000 F        200
       104 Amol       manager           105         30 01-JUN-09      30000 M        300
       103 Soham      analyst           104         50 02-DEC-07      40000 M        200
       107 Samiksha   preci                         90 05-FEB-05      55000 F        400

6 rows selected.

SQL> commit;

Commit complete.

SQL> insert into emp_c values(108,'Swapnali','cleark',120,18,'2 March 2001',15000,'F',300);

1 row created.

SQL> insert into emp_c values(101,'Sonali','cleark',121,25,'2 April 2001',17000,'F',350);

1 row created.

SQL> select * from emp_c;

       ENO ENAME      JOB           MANAGER    DEPT_NO HDATE            SAL G       COMM
---------- ---------- ---------- ---------- ---------- --------- ---------- - ----------
       101 Sagar      cleark            112         10 02-AUG-16      10000 M        200
       102 Sameer     cleark            112         10 05-AUG-17      11000 M        250
       105 Priya      salesman          103         20 03-MAY-11      20000 F        200
       104 Amol       manager           105         30 01-JUN-09      30000 M        300
       103 Soham      analyst           104         50 02-DEC-07      40000 M        200
       107 Samiksha   preci                         90 05-FEB-05      55000 F        400
       108 Swapnali   cleark            120         18 02-MAR-01      15000 F        300
       101 Sonali     cleark            121         25 02-APR-01      17000 F        350

8 rows selected.

SQL> savepoint p1;

Savepoint created.

SQL> select * from emp_c;

       ENO ENAME      JOB           MANAGER    DEPT_NO HDATE            SAL G       COMM
---------- ---------- ---------- ---------- ---------- --------- ---------- - ----------
       101 Sagar      cleark            112         10 02-AUG-16      10000 M        200
       102 Sameer     cleark            112         10 05-AUG-17      11000 M        250
       105 Priya      salesman          103         20 03-MAY-11      20000 F        200
       104 Amol       manager           105         30 01-JUN-09      30000 M        300
       103 Soham      analyst           104         50 02-DEC-07      40000 M        200
       107 Samiksha   preci                         90 05-FEB-05      55000 F        400
       108 Swapnali   cleark            120         18 02-MAR-01      15000 F        300
       101 Sonali     cleark            121         25 02-APR-01      17000 F        350

8 rows selected.




SQL> select * from emp_c
  2  where sal >10000;

       ENO ENAME      JOB           MANAGER    DEPT_NO HDATE            SAL G       COMM
---------- ---------- ---------- ---------- ---------- --------- ---------- - ----------
       102 Sameer     cleark            112         10 05-AUG-17      11000 M        250
       105 Priya      salesman          103         20 03-MAY-11      20000 F        200
       104 Amol       manager           105         30 01-JUN-09      30000 M        300
       103 Soham      analyst           104         50 02-DEC-07      40000 M        200
       107 Samiksha   preci                         90 05-FEB-05      55000 F        400
       108 Swapnali   cleark            120         18 02-MAR-01      15000 F        300
       101 Sonali     cleark            121         25 02-APR-01      17000 F        350

7 rows selected.

SQL> savepoint p2;

Savepoint created.


SQL> update emp_c
  2  set eno=101
  3  where job='salesman';

1 row updated.



SQL> select * from emp_c;

       ENO ENAME      JOB           MANAGER    DEPT_NO HDATE            SAL G       COMM
---------- ---------- ---------- ---------- ---------- --------- ---------- - ----------
       101 Sagar      cleark            112         10 02-AUG-16      10000 M        200
       102 Sameer     cleark            112         10 05-AUG-17      11000 M        250
       101 Priya      salesman          103         20 03-MAY-11      20000 F        200
       104 Amol       manager           105         30 01-JUN-09      30000 M        300
       103 Soham      analyst           104         50 02-DEC-07      40000 M        200
       107 Samiksha   preci                         90 05-FEB-05      55000 F        400
       108 Swapnali   cleark            120         18 02-MAR-01      15000 F        300
       101 Sonali     cleark            121         25 02-APR-01      17000 F        350

8 rows selected.

SQL>  update emp_c
  2  set ename='Amol'
  3  where dept_no=10;

2 rows updated.

SQL> select * from emp_c;

       ENO ENAME      JOB           MANAGER    DEPT_NO HDATE            SAL G       COMM
---------- ---------- ---------- ---------- ---------- --------- ---------- - ----------
       101 Amol       cleark            112         10 02-AUG-16      10000 M        200
       102 Amol       cleark            112         10 05-AUG-17      11000 M        250
       101 Priya      salesman          103         20 03-MAY-11      20000 F        200
       104 Amol       manager           105         30 01-JUN-09      30000 M        300
       103 Soham      analyst           104         50 02-DEC-07      40000 M        200
       107 Samiksha   preci                         90 05-FEB-05      55000 F        400
       108 Swapnali   cleark            120         18 02-MAR-01      15000 F        300
       101 Sonali     cleark            121         25 02-APR-01      17000 F        350

8 rows selected.

SQL> update emp_c
  2  set eno=104
  3  where job='salesman';

1 row updated.

SQL> select * from emp_c;

       ENO ENAME      JOB           MANAGER    DEPT_NO HDATE            SAL G       COMM
---------- ---------- ---------- ---------- ---------- --------- ---------- - ----------
       101 Amol       cleark            112         10 02-AUG-16      10000 M        200
       102 Amol       cleark            112         10 05-AUG-17      11000 M        250
       104 Priya      salesman          103         20 03-MAY-11      20000 F        200
       104 Amol       manager           105         30 01-JUN-09      30000 M        300
       103 Soham      analyst           104         50 02-DEC-07      40000 M        200
       107 Samiksha   preci                         90 05-FEB-05      55000 F        400
       108 Swapnali   cleark            120         18 02-MAR-01      15000 F        300
       101 Sonali     cleark            121         25 02-APR-01      17000 F        350

8 rows selected.

SQL> savepoint p3;

Savepoint created.


SQL> delete from emp_c
  2  where job='cleark';

4 rows deleted.

SQL> select * from emp_c;

       ENO ENAME      JOB           MANAGER    DEPT_NO HDATE            SAL G       COMM
---------- ---------- ---------- ---------- ---------- --------- ---------- - ----------
       104 Priya      salesman          103         20 03-MAY-11      20000 F        200
       104 Amol       manager           105         30 01-JUN-09      30000 M        300
       103 Soham      analyst           104         50 02-DEC-07      40000 M        200
       107 Samiksha   preci                         90 05-FEB-05      55000 F        400

SQL> rollback to p1;

Rollback complete.

SQL> select * from emp_c;

       ENO ENAME      JOB           MANAGER    DEPT_NO HDATE            SAL G       COMM
---------- ---------- ---------- ---------- ---------- --------- ---------- - ----------
       101 Sagar      cleark            112         10 02-AUG-16      10000 M        200
       102 Sameer     cleark            112         10 05-AUG-17      11000 M        250
       105 Priya      salesman          103         20 03-MAY-11      20000 F        200
       104 Amol       manager           105         30 01-JUN-09      30000 M        300
       103 Soham      analyst           104         50 02-DEC-07      40000 M        200
       107 Samiksha   preci                         90 05-FEB-05      55000 F        400
       108 Swapnali   cleark            120         18 02-MAR-01      15000 F        300
       101 Sonali     cleark            121         25 02-APR-01      17000 F        350

8 rows selected.

