
   BOOK_NO BOOK_NAME                      AUTHOR_NAME
---------- ------------------------------ ------------------------------
      COST CATEGORY
---------- ----------
         1 two states                     chetan bhagat
       500 hindi

         1 two states                     chetan bhagat
       500 hindi

         1 halfgirlfriend                 chetan bhagat
       500 english


   BOOK_NO BOOK_NAME                      AUTHOR_NAME
---------- ------------------------------ ------------------------------
      COST CATEGORY
---------- ----------
         1 tum hi ho                      arjit singh
       500 english

         1 engineers theory               raman singh
       150 english


SQL> select initcap(book_name) from Books;

INITCAP(BOOK_NAME)
------------------------------
Two States
Two States
Halfgirlfriend
Tum Hi Ho
Engineers Theory

SQL> select upper(author_name) from Books;

UPPER(AUTHOR_NAME)
------------------------------
CHETAN BHAGAT
CHETAN BHAGAT
CHETAN BHAGAT
ARJIT SINGH
RAMAN SINGH



SQL> select initcap(category),lower(author_name) from Books;

INITCAP(CA LOWER(AUTHOR_NAME)
---------- ------------------------------
Hindi      chetan bhagat
Hindi      chetan bhagat
English    chetan bhagat
English    arjit singh
English    raman singh

SQL>


*******************

SQL> select rpad(author_name, 20,'*') from Books;

RPAD(AUTHOR_NAME,20,
--------------------
arjit singh*********
raman singh*********
raman singh*********

SQL> select LPAD(author_name, 20,'*') from Books;

LPAD(AUTHOR_NAME,20,
--------------------
*********arjit singh
*********raman singh
*********raman singh






SQL> select * from Books;

   BOOK_NO BOOK_NAME                      AUTHOR_NAME
---------- ------------------------------ ------------------------------
      COST CATEGORY
---------- ----------
         1 tum hi ho                      arjit singh
       500 english

         1 engineers theory               raman singh
       150 english

         1 engineers theory               raman singh
       150 english


SQL> select LPAD(author_name, 20,'*') from Books;

LPAD(AUTHOR_NAME,20,
--------------------
*********arjit singh
*********raman singh
*********raman singh

SQL> commit;

Commit complete.

SQL> select * from Books;

   BOOK_NO BOOK_NAME                      AUTHOR_NAME
---------- ------------------------------ ------------------------------
      COST CATEGORY
---------- ----------
         1 tum hi ho                      arjit singh
       500 english

         1 engineers theory               raman singh
       150 english

         1 engineers theory               raman singh
       150 english

**********************************

SQL> select replace(author_name,'ar','aar')from Books;

REPLACE(AUTHOR_NAME,'AR','AAR')
--------------------------------------------------------------

aarjit singh
raman singh
raman singh

SQL> select replace('Nik hil',' ',null)from  dual;

REPLAC
------
Nikhil

*****************************

SQL> select * from Books;

   BOOK_NO BOOK_NAME                      AUTHOR_NAME
---------- ------------------------------ -------------
      COST CATEGORY
---------- ----------
         1 tum hi ho                      arjit singh
       500 english

         1 engineers theory               raman singh
       150 english

         1 engineers theory               raman singh
       150 english


SQL> select length(book_name) from Books;

LENGTH(BOOK_NAME)
-----------------
                9
               16
               16

SQL> select reverse(book_name) from Books;

REVERSE(BOOK_NAME)
------------------------------
oh ih mut
yroeht sreenigne
yroeht sreenigne


*********************


SQL> select substr(author_name,1,3) from Books;

SUB
---
arj
ram
ram



SQL> select substr(author_name,-1,3) from Books;

S
-
h
h
h

SQL> select substr(book_name,-1,3) from Books;

S
-
o
y
y

SQL> select substr(book_name,-6,3) from Books;

SUB
---
 hi
the
the

SQL> select substr(book_name,-9,3) from Books;

SUB
---
tum
rs
rs

SQL> select substr(book_name,-10,3) from Books;

SUB
---

ers
ers

SQL> select substr(book_name,-10,5) from Books;

SUBST
-----

ers t
ers t

SQL> select instr(book_name,'e',2) from Books;

INSTR(BOOK_NAME,'E',2)
----------------------
                     0
                     6
                     6

*********************************************************************

SQL> create table Bookdes
  2  (
  3  author_name varchar2(30),
  4  author_addr varchar2(30)
  5  );

Table created.

SQL> insert into Bookdes values('arjit singh','pune');

1 row created.

SQL> insert into Bookdes values('raman singh','pune');

1 row created.

SQL> select * from Bookdes;

AUTHOR_NAME                    AUTHOR_ADDR
------------------------------ ------------------------------
arjit singh                    pune
raman singh                    pune



SQL> alter table Books
  2  add constraint Books_author_fk
  3  foreign key(author_name)
  4  references Bookdes(author_name);
references Bookdes(author_name)
                   *
ERROR at line 4:
ORA-02270: no matching unique or primary key for this column-list


SQL> alter table Bookdes
  2  add primary key(author_name);

Table altered.

SQL> desc Bookdes;
 Name                                      Null?    Type
 ----------------------------------------- -------- --------------------

 AUTHOR_NAME                               NOT NULL VARCHAR2(30)
 AUTHOR_ADDR                                        VARCHAR2(30)


SQL> select * from Bookdes;

AUTHOR_NAME                    AUTHOR_ADDR
------------------------------ ------------------------------
arjit singh                    pune
raman singh                    pune

SQL> insert into  Bookdes values('arjit singh','nashik');
insert into  Bookdes values('arjit singh','nashik')
*
ERROR at line 1:
ORA-00001: unique constraint (DAC3.SYS_C0036200) violated



SQL> select* from Books;///// here no contraint we have given before ;

   BOOK_NO BOOK_NAME                      AUTHOR_NAME
---------- ------------------------------ ------------------------------
      COST CATEGORY
---------- ----------
         1 tum hi ho                      arjit singh
       500 english

         1 engineers theory               raman singh
       150 english

         1 engineers theory               raman singh
       150 english




SQL> alter table Books
   add constraint Books_author_fk
   foreign key(author_name)
  references Bookdes(author_name);

Table altered.

***************************************
SQL> delete from Books where
  2  author_name ='arjit singh';

1 row deleted.


SQL> select* from Books;


   BOOK_NO BOOK_NAME                      AUTHOR_NAME
---------- ------------------------------ ------------------------------
      COST CATEGORY
---------- ----------
         1 tum hi ho                      arjit singh
       500 english

         1 engineers theory               raman singh



SQL> rollback;

Rollback complete.

SQL> select* from Books;

   BOOK_NO BOOK_NAME                      AUTHOR_NAME
---------- ------------------------------ ------------------------------
      COST CATEGORY
---------- ----------
         1 tum hi ho                      arjit singh
       500 english

         1 engineers theory               raman singh
       150 english

         1 engineers theory               raman singh
       150 english

***************************************************
SQL> delete from  Bookdes
  2  where author_name ='arjit singh';
delete from  Bookdes
*
ERROR at line 1:
ORA-02292: integrity constraint (DAC3.BOOKS_AUTHOR_FK) violated - child recor
found


SQL> delete from Books where
  2  author_name ='arjit singh';

1 row deleted.



  BOOK_NO BOOK_NAME                      AUTHOR_NAME
---------- ------------------------------ ------------------------------
      COST CATEGORY
---------- ----------
 

         1 engineers theory               raman singh





SQL> select * from  Bookdes;

AUTHOR_NAME                    AUTHOR_ADDR
------------------------------ ------------------------------
arjit singh                    pune
raman singh                    pune



SQL> delete from  Bookdes
  2  where author_name ='arjit singh';

1 row deleted.

SQL> select * from Bookdes;

AUTHOR_NAME                    AUTHOR_ADDR
------------------------------ ------------------------------
raman singh                    pune

SQL> rollback;

Rollback complete.
*******************************************



SQL> insert into Bookdes values('viren sharma','mumbai');

1 row created.

SQL> select * from  Bookdes;

AUTHOR_NAME                    AUTHOR_ADDR
------------------------------ ------------------------------
arjit singh                    pune
raman singh                    pune
viren sharma                   mumbai

SQL>***********************************************

SQL> select * from  Bookdes;

AUTHOR_NAME                    AUTHOR_ADDR
------------------------------ ---------------------------
arjit singh                    pune
raman singh                    pune
viren sharma                   mumbai

SQL> delete  from bookdes where
  2   author_name ='viren sharma';

1 row deleted.

SQL> select* from bookdes;

AUTHOR_NAME                    AUTHOR_ADDR
------------------------------ ---------------------------
arjit singh                    pune
raman singh                    pune

SQL>******************************************************************